{"SchemaVersion":"amd-graphics-publication-manifest/1.3","ToolkitVersion":"1.0.0","GeneratedAtUtc":"2026-08-12T17:54:50.1330536Z","PathFormat":"POSIXRelative","ManifestSelfIncluded":false,"PublicRootPolicy":"Only files under public/ are intended for automated repository commits.","PrivateDataPolicy":"private/, inventory/, reports/, work/ and operator-specified evidence locations are not publication surfaces.","CanonicalJsonPolicy":"Canonical JSON is compact at generation time. Publication copies canonical runtime JSON byte-for-byte and never performs publication-time JSON minification or parse/reserialization.","TransformationPolicy":["Canonical per-artifact Raw JSON and aggregate JSON are compact when generated by the toolkit.","Runtime canonical JSON and CSV are copied into staging byte-for-byte and are never publication-time reserialized or line-ending normalized.","Generated public Markdown is deterministically normalized to UTF-8 without BOM and LF line endings; Markdown content is otherwise unchanged.","Source SHA-256 is recorded against the runtime pre-publication artifact while published SHA-256 is computed from the normalized public Markdown bytes.","Public JSON privacy validation parses JSON and inspects decoded scalar strings so escaped Windows paths cannot evade detection.","No generated public JSON/CSV/Markdown is intended to be hand-edited."],"FileCount":64,"ManifestEntryCount":64,"PublicFileCountIncludingManifest":65,"ManifestedPayloadSizeBytes":129538868,"LargestManifestedFileSizeBytes":11794222,"LargestManifestedFileRelativePath":"inventory/releases/26.7.1/whql-amd-software-adrenalin-edition-26.7.1-win11-b.json","Files":[{"RelativePath":"inventory/all-releases-summary.json","SizeBytes":9386,"Sha256":"4a4fbd9f1f99d3fe0693a87d790cc0b4bcf555cd2dde632de35a2cbb0a90b00a","Classification":"PublicRepositoryArtifact","GenerationMode":"ByteCopyFromRuntime","SourceRelativePath":"inventory/all-releases-summary.json","SourceSha256":"4a4fbd9f1f99d3fe0693a87d790cc0b4bcf555cd2dde632de35a2cbb0a90b00a","HandEdited":false},{"RelativePath":"inventory/device-server-compatibility-matrix.csv","SizeBytes":458185,"Sha256":"942e8e4f8bff38fce93cd71a8c0c0677072aea46ab3f3c112c63c6ca9ae929da","Classification":"PublicRepositoryArtifact","GenerationMode":"ByteCopyFromRuntime","SourceRelativePath":"inventory/device-server-compatibility-matrix.csv","SourceSha256":"942e8e4f8bff38fce93cd71a8c0c0677072aea46ab3f3c112c63c6ca9ae929da","HandEdited":false},{"RelativePath":"inventory/inf-topology.json","SizeBytes":7870,"Sha256":"170c87d2956573ad7760ccbe22dd7fcb610f04f816e99dc7efd5464fab521be8","Classification":"PublicRepositoryArtifact","GenerationMode":"ByteCopyFromRuntime","SourceRelativePath":"inventory/inf-topology.json","SourceSha256":"170c87d2956573ad7760ccbe22dd7fcb610f04f816e99dc7efd5464fab521be8","HandEdited":false},{"RelativePath":"inventory/product-driver-mapping.json","SizeBytes":3945284,"Sha256":"a9f5cb4620815844d0e9a30ed2c54df6db2e82c84a0af71072cea10093747bc6","Classification":"PublicRepositoryArtifact","GenerationMode":"ToolkitGeneratedOrPreservedBaseline","SourceRelativePath":null,"SourceSha256":null,"HandEdited":false},{"RelativePath":"inventory/product-groups.json","SizeBytes":14964,"Sha256":"a115c3bb8cdeaded0bea8be11860e7e607ac2c454758a14a2af4d208caa3156f","Classification":"PublicRepositoryArtifact","GenerationMode":"ByteCopyFromRuntime","SourceRelativePath":"inventory/product-groups.json","SourceSha256":"a115c3bb8cdeaded0bea8be11860e7e607ac2c454758a14a2af4d208caa3156f","HandEdited":false},{"RelativePath":"inventory/products.json","SizeBytes":27028,"Sha256":"2eb4fa4dae4b7f7e0bf3e0e1c05fbb9f3e721f05d85195f2c20c68e161dd00a7","Classification":"PublicRepositoryArtifact","GenerationMode":"ToolkitGeneratedOrPreservedBaseline","SourceRelativePath":null,"SourceSha256":null,"HandEdited":false},{"RelativePath":"inventory/releases/21.q4/win10-win11-radeon-pro-software-21.q4-dec3.json","SizeBytes":1039864,"Sha256":"89933fa9582223611eb9254abf2f242b0ba659c5563541700b8f7e75aec6be62","Classification":"PublicRepositoryArtifact","GenerationMode":"ByteCopyFromRuntimeCanonical","SourceRelativePath":"inventory/releases/21.q4/win10-win11-radeon-pro-software-21.q4-dec3.json","SourceSha256":"89933fa9582223611eb9254abf2f242b0ba659c5563541700b8f7e75aec6be62","HandEdited":false},{"RelativePath":"inventory/releases/21.q4/winsvr2016-radeon-pro-software-21.q4-for-amd-radeon-pro-w6400.json","SizeBytes":1575614,"Sha256":"bbedaffa55e6c3d28a30ae875de35283ec8f38bcabc8a7e405857543992155af","Classification":"PublicRepositoryArtifact","GenerationMode":"ByteCopyFromRuntimeCanonical","SourceRelativePath":"inventory/releases/21.q4/winsvr2016-radeon-pro-software-21.q4-for-amd-radeon-pro-w6400.json","SourceSha256":"bbedaffa55e6c3d28a30ae875de35283ec8f38bcabc8a7e405857543992155af","HandEdited":false},{"RelativePath":"inventory/releases/22.q4/amd-software-pro-edition-22.q4-win10-win11-nov15.json","SizeBytes":1224730,"Sha256":"f35e1d92ac8ad1867b9bebaa56b1a0d491ed45edbd896036447e6b5cddc33377","Classification":"PublicRepositoryArtifact","GenerationMode":"ByteCopyFromRuntimeCanonical","SourceRelativePath":"inventory/releases/22.q4/amd-software-pro-edition-22.q4-win10-win11-nov15.json","SourceSha256":"f35e1d92ac8ad1867b9bebaa56b1a0d491ed45edbd896036447e6b5cddc33377","HandEdited":false},{"RelativePath":"inventory/releases/22.q4/amd-software-pro-edition-22.q4-winsvr2016-nov15.json","SizeBytes":2037024,"Sha256":"197e01779f0f0f48c6f0bb3ec2c1aff448a917f8b707ead7d27634f25c1d5779","Classification":"PublicRepositoryArtifact","GenerationMode":"ByteCopyFromRuntimeCanonical","SourceRelativePath":"inventory/releases/22.q4/amd-software-pro-edition-22.q4-winsvr2016-nov15.json","SourceSha256":"197e01779f0f0f48c6f0bb3ec2c1aff448a917f8b707ead7d27634f25c1d5779","HandEdited":false},{"RelativePath":"inventory/releases/23.q4/amd-software-pro-edition-23.q4-winsvr2019-dec-2023.json","SizeBytes":957539,"Sha256":"c9246bd72c1320cb1d676f484e3f8545e6e2a6031eaaaa26739761657024845a","Classification":"PublicRepositoryArtifact","GenerationMode":"ByteCopyFromRuntimeCanonical","SourceRelativePath":"inventory/releases/23.q4/amd-software-pro-edition-23.q4-winsvr2019-dec-2023.json","SourceSha256":"c9246bd72c1320cb1d676f484e3f8545e6e2a6031eaaaa26739761657024845a","HandEdited":false},{"RelativePath":"inventory/releases/23.q4/amd-software-pro-edition-23.q4-winsvr2022-dec-2023.json","SizeBytes":1348715,"Sha256":"3a3b3f67983daa827813aca2386a9527b8f7f7727f63aa96f86e23d3f9e37671","Classification":"PublicRepositoryArtifact","GenerationMode":"ByteCopyFromRuntimeCanonical","SourceRelativePath":"inventory/releases/23.q4/amd-software-pro-edition-23.q4-winsvr2022-dec-2023.json","SourceSha256":"3a3b3f67983daa827813aca2386a9527b8f7f7727f63aa96f86e23d3f9e37671","HandEdited":false},{"RelativePath":"inventory/releases/24.12.1/whql-amd-software-adrenalin-edition-24.12.1-win10-win11-dec-rdna.json","SizeBytes":10090154,"Sha256":"a872b1bf74c60dfe6f1718e729101bdb046cde08955c14a5ea3f8062e1d3313a","Classification":"PublicRepositoryArtifact","GenerationMode":"ByteCopyFromRuntimeCanonical","SourceRelativePath":"inventory/releases/24.12.1/whql-amd-software-adrenalin-edition-24.12.1-win10-win11-dec-rdna.json","SourceSha256":"a872b1bf74c60dfe6f1718e729101bdb046cde08955c14a5ea3f8062e1d3313a","HandEdited":false},{"RelativePath":"inventory/releases/24.9.1/whql-amd-software-adrenalin-edition-24.9.1-win10-win11-vega-polaris.json","SizeBytes":9470699,"Sha256":"214f4874e442f0de7eef61aeb44b410bad624f96d7f277fb9b23b61ed357da43","Classification":"PublicRepositoryArtifact","GenerationMode":"ByteCopyFromRuntimeCanonical","SourceRelativePath":"inventory/releases/24.9.1/whql-amd-software-adrenalin-edition-24.9.1-win10-win11-vega-polaris.json","SourceSha256":"214f4874e442f0de7eef61aeb44b410bad624f96d7f277fb9b23b61ed357da43","HandEdited":false},{"RelativePath":"inventory/releases/24.q4/amd-software-pro-edition-24.q4-win10-win11-nov-rdna-combined.json","SizeBytes":10796864,"Sha256":"174305384093b2e2a342b7f9b295c0a77ce6c2214ae07b6e9319124fdf173d5d","Classification":"PublicRepositoryArtifact","GenerationMode":"ByteCopyFromRuntimeCanonical","SourceRelativePath":"inventory/releases/24.q4/amd-software-pro-edition-24.q4-win10-win11-nov-rdna-combined.json","SourceSha256":"174305384093b2e2a342b7f9b295c0a77ce6c2214ae07b6e9319124fdf173d5d","HandEdited":false},{"RelativePath":"inventory/releases/24.q4/amd-software-pro-edition-24.q4-winsvr2019-nov-rdna-combined.json","SizeBytes":2054151,"Sha256":"a61e7f75c4177f0a2e35741b7b15ee62c50c641717d0a6a3cccd457a481ae25c","Classification":"PublicRepositoryArtifact","GenerationMode":"ByteCopyFromRuntimeCanonical","SourceRelativePath":"inventory/releases/24.q4/amd-software-pro-edition-24.q4-winsvr2019-nov-rdna-combined.json","SourceSha256":"a61e7f75c4177f0a2e35741b7b15ee62c50c641717d0a6a3cccd457a481ae25c","HandEdited":false},{"RelativePath":"inventory/releases/24.q4/amd-software-pro-edition-24.q4-winsvr2022-nov-rdna-combined.json","SizeBytes":2422920,"Sha256":"b1738f1905b343be3a7c8f6994fc3fc24af78855487d3909e3d361943bb2de5d","Classification":"PublicRepositoryArtifact","GenerationMode":"ByteCopyFromRuntimeCanonical","SourceRelativePath":"inventory/releases/24.q4/amd-software-pro-edition-24.q4-winsvr2022-nov-rdna-combined.json","SourceSha256":"b1738f1905b343be3a7c8f6994fc3fc24af78855487d3909e3d361943bb2de5d","HandEdited":false},{"RelativePath":"inventory/releases/25.11.1/whql-amd-software-adrenalin-edition-25.11.1-win11-s.json","SizeBytes":7001564,"Sha256":"09ceb74dd943fa6cf69b0b775f54bfe9917b0ce71b1096e3e5e484c1480acb1b","Classification":"PublicRepositoryArtifact","GenerationMode":"ByteCopyFromRuntimeCanonical","SourceRelativePath":"inventory/releases/25.11.1/whql-amd-software-adrenalin-edition-25.11.1-win11-s.json","SourceSha256":"09ceb74dd943fa6cf69b0b775f54bfe9917b0ce71b1096e3e5e484c1480acb1b","HandEdited":false},{"RelativePath":"inventory/releases/25.12.1/whql-amd-software-adrenalin-edition-25.12.1-win11-a.json","SizeB